COUNTRY,STATEMENT
Indonesia,"Mr. President, 

Many Leaders have spoken here over the past few days.

We share the same concerns.

The current state of our world is very worrying.

The pandemic persists and global economy remains sluggish.

War among nations is no longer a possibility but has become a reality.

Violation of international law has become a norm in pursuit of narrow self-interest.

Crisis after crisis is unfolding around the world: climate change, rising inflation, food and energy shortages.

 

Mr. President,

History teaches us these phenomena might lead to a huge war.

Let us look at the period leading up to Second World War.

The Great Depression, rise of ultra nationalism, competition over resources and rivalry between major powers.

These are very similar to what we are facing today.

Clearly, we have been handling these challenges the wrong way.

We have been divided instead of united.

We have been working individually instead of collectively.

We have been focusing on words instead of deeds.

The question now what are we going to do about it?

Are we going to continue on the same path? Or are we going to choose a different path?

If we continue on the same path, we would be heading towards a disaster.

But if we choose a different path, we might stand a chance.

So, today I would like to offer you a world based on a new paradigm.

A paradigm of win-win not of zero-sum.

A paradigm of engagement not of containment.

A paradigm of collaboration not of competition.

This is the transformative solution that we need.

 

Mr. President,

Allow me to share with you why we need this new paradigm.

First, to reignite the spirit of peace.

Trust deficit breeds hatred and fear and may lead into conflict.

We witnessed these phenomena in many parts of the world.

We must turn trust deficit into strategic trust. 

And it starts with upholding respect for international law.

The fundamental principles of sovereignty and territorial integrity are non-negotiable.

I repeat, the fundamental principles of sovereignty and territorial integrity are non-negotiable.

These principles must always be upheld.

Meanwhile, peaceful solution is the only option to settle any conflicts.

A habit of dialogue and cooperation would nurture strategic trust.

These are the rules of the game that we must maintain if we truly want peace.

It is our responsibility to apply them consistently, not selectively, or only when we see fit.

My President conveyed these messages of peace in his visits to Kyiv and Moscow last June.

We must also apply this new paradigm to make a breakthrough in Palestine and Afghanistan.

For far too long, the peoples in Palestine have suffered and longed-for peace.

Until Palestine can truly become an independent State, Indonesia would stand firm in solidarity with our Palestinian brothers and sisters.

Peoples in Afghanistan also deserve a peaceful and prosperous life. 

Where the rights of all peoples, including women, are equally respected.

Where access to education for women and girls are granted.

Without this new paradigm, peace would remain an elusive dream.?

Second, to revive our responsibility for global recovery.

We are concerned that global solidarity is fading away, whereas injustice and selfishness abound, the weak stands small and the mighty takes all.

We are seeing the symptoms every day. 

Trade discrimination is running rampant. Monopoly in global supply chain persists. Global economic governance is used to justify the rules of the strong. 

The pandemic teaches us a valuable lesson that no one is safe until everyone is.

This lesson shapes the priorities of Indonesia's G20 Presidency.

The whole world is pinning their hope on G20 to be a catalyst of global economic recovery, especially for developing countries.

G20 must not fail. We cannot let global recovery fall at the mercy of geopolitics.

We must act urgently to address food and energy crises and prevent a fertilizer crisis from happening.

Otherwise, billions more people would be at risk, particularly in developing countries.

We also need a new paradigm as we move beyond the recovery.

A new paradigm would instill a collective responsibility to attain the 2030 Agenda and fight climate change.

Without this new paradigm, there would not be a strong recovery for all and many of us would be left behind.

Third, to bolster regional partnership.

 

Mr. President,

In many places, post-War regional architecture was built as a tool for containment and alienation.

This phenomenon continues today with mini-lateral groupings.

Many become part of a proxy war between major powers.

This is not what regional architecture should be.

It must serve as the building block for peace and stability rather than undermining them.

ASEAN was built exactly for this purpose.

We refuse to be a pawn in a new Cold War.

Instead, we actively promote the paradigm of collaboration with all countries.

This paradigm will also guide Indonesia's Chairmanship in ASEAN next year.

It is the commitment of Indonesia to reinforce ASEAN's centrality in shaping regional order in the Indo-Pacific; to forge unity as a locomotive for peace, stability, and prosperity in the region; and to ensure ASEAN matters for our peoples, for the region, and for the world. 

ASEAN will also continue to seriously address the situation in Myanmar.

Indonesia is deeply concerned by the military's lack of commitment to implement the Five-Points Consensus.

ASEAN must move forward and not be taken hostage by the situation in Myanmar.

The support of the international community, in particular the neighboring countries of Myanmar, is very important to bring back democracy in Myanmar.

On Pacific, Indonesia will continue to strengthen our cooperation with the Pacific countries.

We will work together to address our shared challenges including on climate change.

As a Pacific nation ourselves, we want to see the Pacific as an integral part of a peaceful, stable, and prosperous Indo-Pacific.

 

Mr. President,?

The new paradigm of collaboration must be the spirit of the UN. 

Inclusive and meaningful engagement must trump above take it or leave it approach.

Whereas, the voices of all countries: big and small, developed and developing must equally matter.

This is the very foundation of multilateralism.

That is why we need a strong and reformed UN.

That is why we need a renewed multilateralism that is fit for purpose and that is fit for its time.

That is why we need a multilateralism that delivers. 

I repeat, we need a multilateralism that delivers.

I believe by working together and adopting a new paradigm we can create a better world for all.

It is no longer the time to talk the talk. 

Now is the time to walk the talk.?

I thank you very much."
